{
  "_schema": "ruptura.vtt.content.equipamentos.v1.2",
  "_meta": {
    "conteudo": "equipamentos",
    "fonte": "Capitulo 19 — Mercado Noturno (ARMAS E ARMADURAS, EXPLOSIVOS, FARMACIA, FERRAMENTAS E UTILIDADES, DISPOSITIVOS TECNOLOGICOS, VEICULOS, VERTINAS) + ruptura_vtt_tabelas_mestre.md",
    "versao_schema": "1.2.0",
    "status_padrao": "published",
    "gerado_em": "2026-06-29",
    "total_registros": 119,
    "hash_sha256_origem": "090d0c585b7c04cbda0ac5bd8a778118ba3866a62266a9e91a4a3b235f68e38f",
    "hashes_por_fonte": {
      "ARMAS_E_ARMADURAS": "b2f970c34dfd5cf481440d1bb92f40c12161a2a2b56e9997ecdd9567a4c0592f",
      "EXPLOSIVOS": "f48ab6d8891bf74838efb29f429d533a27c53817a5aad5f9eaa8ec906a9fba43",
      "FARMACIA": "1d6b2ea5ecb177cd0345edbd4f364c1b315fa5e5574af7828dc32f604a132dcb",
      "FERRAMENTAS_E_UTILIDADES": "2583c0097cb48f721ceb97abcece8a8353b78cb73f138b821ed381c929d1bfe2",
      "DISPOSITIVOS_TECNOLOGICOS": "2b5667405959932e9ff3594693d1be0881f4b994c90152728204d445b3834e48",
      "VEICULOS": "3c913c0026f03bf46de3832d0c3074a82c0926aa9374244ab53415000eb52bb8",
      "VERTINAS": "006e7a3dd97ef1f299faace81fcc5dda7069275519dee620c56e70829d8e9249"
    },
    "precedencia_fonte": "bloco_detalhado_sobre_tabela_resumo",
    "divergencias_fonte": [
      "Espingarda: municao 5 e propriedade Dispersao (bloco detalhado) sobre 8/Sangramento (tabela).",
      "Metralhadora: raridade mantida como 'raro' (tabela); bloco detalhado diz 'muito rara'.",
      "Bateria runica: 5 cargas (bloco detalhado) sobre 3 (tabela).",
      "Moto planada popular: 12.000 (bloco detalhado) sobre 13.000 (tabela).",
      "Injetor de adrenalina: Lento por 10 minutos e duplicacao por reaplicacao (bloco detalhado)."
    ],
    "observacoes": [
      "Dano normalizado em tipo_dano (M6) + subtipo_dano; cortante_ou_perfurante usa subtipos_dano_possiveis.",
      "Estatisticas de item separadas de payload_automacao; efeitos acionaveis em payload_automacao.efeitos[].",
      "Resistencia normalizada: 'Desviar' do livro mapeia para a acao 'esquivar' (rotulo_livro preservado); 'Resistir' mapeia para a acao 'resistir'.",
      "Granadas nao trazem CD na fonte: resistencia.cd = null (definido pelo arremesso/narrador).",
      "Tags restritas a M11 estendida (+eletrico, +gelido, +acido); tags-categoria redundantes removidas.",
      "Compatibilidade de municao normalizada como FK por slug de arma.",
      "M17 estendida com a categoria 'municao' (decisao do usuario).",
      "Kravita e modificador de material no nivel de instancia (+1 dano arma, +2 MIT armadura, +3 PD escudo), nao item nem runa.",
      "Custos de PM/preco placeholder seguem fechamento em playtest quando aplicavel."
    ],
    "revisao_v1_2": [
      "Adicionados created_at/updated_at por registro (alinhamento com os bancos irmaos)."
    ]
  },
  "enums": {
    "status": [
      "draft",
      "published",
      "archived"
    ],
    "categorias": [
      "arma",
      "armadura",
      "escudo",
      "explosivo",
      "farmacia",
      "vertina",
      "ferramenta",
      "dispositivo",
      "veiculo",
      "municao"
    ],
    "raridade": [
      "comum",
      "incomum",
      "muito_comum",
      "muito_raro",
      "raro"
    ],
    "tipo_dano": [
      "acido",
      "energetico",
      "fisico",
      "psiquico",
      "toxico",
      "trauma"
    ],
    "subtipo_dano": [
      "cortante",
      "contundente",
      "perfurante",
      "igneo",
      "gelido",
      "eletrico",
      "acido",
      "toxico",
      "psiquico",
      "trauma"
    ],
    "pericias": [
      "arcanismo",
      "artes",
      "balistica",
      "biologia",
      "carisma",
      "engenharia",
      "furtividade",
      "influencia",
      "intimidacao",
      "logica",
      "luta",
      "mobilidade",
      "percepcao",
      "precisao",
      "psicologia",
      "reflexos",
      "robotica",
      "sociedade",
      "tecnomagia",
      "vigor",
      "vontade"
    ],
    "propriedades_arma": [
      "alcance",
      "aparar",
      "arremesso",
      "atordoamento",
      "contusao",
      "desarme",
      "dispersao",
      "empurrao",
      "perfuracao",
      "precisao",
      "queimadura",
      "rajada",
      "sangramento",
      "silencioso"
    ],
    "regioes_corpo": [
      "bracos",
      "cabeca",
      "pernas",
      "tronco"
    ],
    "condicoes": [
      "agarrado",
      "agarrando",
      "atordoado",
      "caido",
      "cego",
      "contundido",
      "envenenado",
      "imobilizado",
      "inconsciente",
      "insaturado",
      "lento",
      "ofuscado",
      "queimando",
      "sangrando",
      "saturado",
      "sufocando",
      "surdo"
    ],
    "tags_sistema": [
      "acao",
      "acao_remove",
      "acido",
      "ambiente",
      "arcano",
      "arma",
      "armadura",
      "asfixia",
      "ativo",
      "audicao",
      "companheiro",
      "conjuracao",
      "controle",
      "cronometro",
      "cura",
      "dano",
      "dano_continuo",
      "defensiva",
      "drone",
      "economia",
      "eletrico",
      "equipamento",
      "escudo",
      "falha_automatica",
      "fim_de_rodada",
      "fisico",
      "furtividade",
      "gelido",
      "igneo",
      "incapacitante",
      "loja",
      "magia",
      "malha",
      "mana",
      "margem",
      "mit",
      "movimento",
      "narrativo",
      "ofensiva",
      "pa",
      "passivo",
      "pd",
      "penalidade",
      "penalidade_atributo",
      "penalidade_defensiva",
      "penalidade_ofensiva",
      "penalidade_pericia",
      "pericia",
      "postura",
      "reacao",
      "reduz_pa",
      "relacional",
      "remove_por_cura",
      "restricao_movimento",
      "risco_morte",
      "robo",
      "robotica",
      "runa",
      "saturacao",
      "sentido",
      "sobrecarga",
      "social",
      "suporte",
      "teste_unico_por_cena",
      "trama",
      "trava_acao",
      "trava_defensiva",
      "trava_ofensiva",
      "trava_reacao",
      "veneno",
      "visao",
      "vulneravel"
    ],
    "tipo_efeito": [
      "ambiente",
      "aplicar_condicao",
      "ataque_adicional",
      "buff_magia",
      "buff_temporario",
      "cura",
      "dano_em_area",
      "desativar_dispositivos",
      "economia_pa",
      "efeito_com_resistencia",
      "emocao_artificial",
      "estabilizar",
      "interferencia_sinal",
      "mana_temporaria",
      "modificador",
      "narrativo",
      "penalidade_pericia",
      "recurso",
      "reduzir_pa",
      "remover_condicao",
      "revelar",
      "utilitario"
    ],
    "tipo_protecao": [
      "fisica",
      "energetica",
      "hibrida"
    ],
    "classe_porte": [
      "leve",
      "media",
      "pesada"
    ],
    "acoes_defesa": [
      "esquivar",
      "resistir",
      "aparar",
      "bloquear"
    ]
  },
  "contagem_por_categoria": {
    "arma": 31,
    "armadura": 18,
    "dispositivo": 8,
    "escudo": 6,
    "explosivo": 10,
    "farmacia": 10,
    "ferramenta": 12,
    "municao": 10,
    "veiculo": 6,
    "vertina": 8
  },
  "itens": [
    {
      "id": "faca",
      "slug": "faca",
      "nome": "Faca",
      "categoria": "arma",
      "categoria_label": "Arma",
      "raridade": "muito_comum",
      "raridade_label": "Muito Comum",
      "preco": 15,
      "descricao_curta": "Lâmina curta e versátil, usada em cozinha, caça ou combate.",
      "descricao_longa": "Lâmina curta e versátil, usada em cozinha, caça ou combate. Serve para confrontos corpo a corpo e arremessos rápidos e discretos, sendo o instrumento de ataque mais difundido nas ruas.",
      "tags": [
        "arma",
        "equipamento",
        "loja",
        "dano"
      ],
      "subtipo": "corpo_a_corpo",
      "estatisticas": {
        "tipo_arma": "corpo_a_corpo",
        "classe_porte": "leve",
        "dado_dano": "1d6",
        "soma_atributo": "corpo",
        "pericia_teste": "luta",
        "alcance": {
          "tipo": "adjacente"
        },
        "propriedades": [
          "arremesso",
          "silencioso"
        ],
        "slots_runa_max": 1,
        "tipo_dano": "fisico",
        "subtipo_dano": "perfurante",
        "arremesso": {
          "pericia_teste": "precisao",
          "eficaz_m": 10,
          "max_m": 20,
          "penalidade_alem_eficaz": -2,
          "soma_atributo": null
        }
      },
      "payload_automacao": {
        "efeitos": []
      },
      "status": "published",
      "versao": "1.2.0",
      "created_at": "2026-06-29",
      "updated_at": "2026-06-29"
    },
    {
      "id": "adaga",
      "slug": "adaga",
      "nome": "Adaga",
      "categoria": "arma",
      "categoria_label": "Arma",
      "raridade": "comum",
      "raridade_label": "Comum",
      "preco": 120,
      "descricao_curta": "Projetada para matar, com lâmina dupla e ponta reforçada que otimiza cortes e estocadas rápidas.",
      "descricao_longa": "Projetada para matar, com lâmina dupla e ponta reforçada que otimiza cortes e estocadas rápidas. Discreta e amplamente usada por militares, agentes e assassinos.",
      "tags": [
        "arma",
        "equipamento",
        "loja",
        "dano"
      ],
      "subtipo": "corpo_a_corpo",
      "estatisticas": {
        "tipo_arma": "corpo_a_corpo",
        "classe_porte": "leve",
        "dado_dano": "1d6",
        "soma_atributo": "corpo",
        "pericia_teste": "luta",
        "alcance": {
          "tipo": "adjacente"
        },
        "propriedades": [
          "sangramento"
        ],
        "slots_runa_max": 1,
        "tipo_dano": "fisico",
        "subtipos_dano_possiveis": [
          "cortante",
          "perfurante"
        ]
      },
      "payload_automacao": {
        "efeitos": []
      },
      "status": "published",
      "versao": "1.2.0",
      "created_at": "2026-06-29",
      "updated_at": "2026-06-29"
    },
    {
      "id": "soco_ingles",
      "slug": "soco_ingles",
      "nome": "Soco-inglês",